{
  "skill_id": "agent-browser",
  "version": "0.2.0",
  "provides": [
    "ui.authority.all-systems",
    "browser.agent"
  ],
  "requires": [
    "node",
    "npm"
  ],
  "entry": "Agent-X:skills/agent-browser/SKILL.md",
  "hash_sha256": "04afeeb53a8b6ab953974311ec7ed60e0d66c532341ca21933625320f28b01c6",
  "authority": "ui",
  "tests": [
    "scripts/mount_agent_browser.py"
  ]
}
